MCQ,Choices,Correct
What is machine learning?,a: The study of computer gaming and artificial intelligence | b: The development and study of statistical algorithms that can perform tasks without explicit instructions | c: The application of mathematical optimization methods | d: The study of exploratory data analysis through unsupervised learning,b
Which field of study focuses on exploratory data analysis through unsupervised learning?,a: Machine learning | b: Artificial intelligence | c: Data mining | d: Mathematical optimization,c
Who coined the term 'machine learning'?,a: Arthur Samuel | b: Donald Hebb | c: Walter Pitts | d: Warren McCulloch,a
What was the purpose of the experimental 'learning machine' called Cybertron?,a: To analyze sonar signals | b: To recognize patterns | c: To classify cancerous moles | d: To predict stock trading outcomes,b
What is the objective of modern-day machine learning?,a: To study human cognitive processes | b: To develop mathematical models of neural networks | c: To classify data based on developed models and make predictions for future outcomes | d: To analyze speech patterns using reinforcement learning,c
